<!DOCTYPE character SYSTEM "https://raw.githubusercontent.com/ThatOneIdiotXav/nova-basegame-actuallyfuckingfinished/main/syntax/character.dtd">
<character x="0" y="350" camX="0" camY="0" isPlayer="true" antialiasing="true" singDuration="4" deathCharacter="bf" icon="bf" flipX="true" danceSteps="idle" >
    <anims>
        <anim name="firstDeath" anim="BF dies" indices="" fps="24" loop="false" x="37" y="11" />
        <anim name="deathLoop" anim="BF Dead Loop" indices="" fps="24" loop="true" x="37" y="5" />
        <anim name="deathConfirm" anim="BF Dead confirm" indices="" fps="24" loop="false" x="37" y="69" />
    </anims>

    <scale x="1" y="1" />
    <scrollFactor x="1" y="1" />

    <healthColor rgb="49,176,209" />
</character>